"field1","field2","field3","entity","type","taxonSpecific","values","valuesConstrained","family","example","description","apObligate","apMinimalist","AP_Presence_Only","AP_Presence_Absence","AP_Forecasting","AP_dismo","AP_biomod2","Questions"
"data","occurrence",NA,"taxa","character vector","yes",NA,"no",NA,"Acer rubrum; Nasua_nasua;","A character vector containing all of the taxa used in the model(s).",1,"NULL","NULL","NULL","NULL","NULL","NULL",NA
"data","occurrence",NA,"dataType","character vector","no","presence only; presence abscence; abundance; occupancy","kinda",NA,"presence only;  presence abscence; abundance","The type of records used in modeling. If multiuple types are combined this can be a vector. For example some point process modeling frameworks combine presence only and presence absence data so this would be specified (in R) as c('presence only', 'presences absence').",1,"NULL","NULL","NULL","NULL","NULL","NULL",NA
"data","occurrence",NA,"yearMin","integer vector","kinda",NA,"no",NA,"1900; NA","If a temporal range of records was used, this is the earliest year used.  Abscence or NA implies that there was no lower limit.",0,"NULL","NULL","NULL","NULL","NULL","NULL",NA
"data","occurrence",NA,"yearMax","integer vector","kinda",NA,"no",NA,"2000; NA","If a temporal range of records was used, this is the latest year used.  Abscence or NA implies there is no upper boundary used.",0,"NULL","NULL","NULL","NULL","NULL","NULL",NA
"data","occurrence",NA,"sources","character vector","kinda",NA,"no",NA,"@article{maitner2017bien,title={The bien r package: A tool to access the Botanical Information and Ecology Network (BIEN) database},author={Maitner, Brian S and Boyle, Brad and Casler, Nathan and Condit, Rick and Donoghue, John and Dur{\'a}n, Sandra M and Guaderrama, Daniel and Hinchliff, Cody E and J{\o}rgensen, Peter M and Kraft, Nathan JB and others},journal={Methods in Ecology and Evolution}, year={2017},publisher={Wiley Online Library}}","A single bibtex format citation or a vector of bibtex format citations.",1,"NULL","NULL","NULL","NULL","NULL","NULL",NA
"data","occurrence",NA,"presenceSampleSize","integer vector","yes",NA,"no",NA,NA,"provide a vector of values in the order that taxa are listed in data$taxaVector",1,"NULL","NULL","NULL","NULL","NULL","NULL",NA
"data","occurrence",NA,"absenceSampleSize","integer vector","yes",NA,"no",NA,NA,"provide a vector of values in the order that taxa are listed in data$taxaVector",0,"NULL","NULL","NULL","NULL","NULL","NULL",NA
"data","occurrence",NA,"backgroundSampleSize","integer vector","kinda",NA,"no",NA,NA,"provide a vector of values in the order that taxa are listed in data$taxaVector",0,"NULL","NULL","NULL","NULL","NULL","NULL",NA
"data","environment",NA,"variableNames","character vector","kinda","bio1; bio2; bio3; bio4; bio5; bio6; bio7; bio8; bio9; bio10; bio11; bio12; bio13; bio14; bio15; bio16; bio17; bio18; bio19; wc2.0_bio_10m_01; wc2.0_bio_5m_01; wc2.0_bio_1m_01; wc2.0_bio_10m_02; wc2.0_bio_5m_02; wc2.0_bio_1m_02; wc2.0_bio_10m_03; wc2.0_bio_5m_03; wc2.0_bio_1m_03; wc2.0_bio_10m_04; wc2.0_bio_5m_04; wc2.0_bio_1m_04; wc2.0_bio_10m_05; wc2.0_bio_5m_05; wc2.0_bio_1m_05; wc2.0_bio_10m_06; wc2.0_bio_5m_06; wc2.0_bio_1m_06; wc2.0_bio_10m_07; wc2.0_bio_5m_07; wc2.0_bio_1m_07; wc2.0_bio_10m_08; wc2.0_bio_5m_08; wc2.0_bio_1m_08; wc2.0_bio_10m_09; wc2.0_bio_5m_09; wc2.0_bio_1m_09; wc2.0_bio_10m_10; wc2.0_bio_5m_10; wc2.0_bio_1m_10; wc2.0_bio_10m_11; wc2.0_bio_5m_11; wc2.0_bio_1m_11; wc2.0_bio_10m_12; wc2.0_bio_5m_12; wc2.0_bio_1m_12; wc2.0_bio_10m_13; wc2.0_bio_5m_13; wc2.0_bio_1m_13; wc2.0_bio_10m_14; wc2.0_bio_5m_14; wc2.0_bio_1m_14; wc2.0_bio_10m_15; wc2.0_bio_5m_15; wc2.0_bio_1m_15; wc2.0_bio_10m_16; wc2.0_bio_5m_16; wc2.0_bio_1m_16; wc2.0_bio_10m_17; wc2.0_bio_5m_17; wc2.0_bio_1m_17; wc2.0_bio_10m_18; wc2.0_bio_5m_18; wc2.0_bio_1m_18; wc2.0_bio_10m_19; wc2.0_bio_5m_19; wc2.0_bio_1m_19","kinda",NA,NA,"Environmental  variable names, preferably as they appear in the source.",1,"NULL","NULL","NULL","NULL","NULL","NULL",NA
"data","environment",NA,"yearMin","integer vector","kinda",NA,"no",NA,"1970;","The first year of the temporal range of climate data in the environmental layers.",0,"NULL","NULL","NULL","NULL","NULL","NULL",NA
"data","environment",NA,"yearMax","integer vector","kinda",NA,"no",NA,"2000;","The last year of the temporal range of climate data in the environmental layers.",0,"NULL","NULL","NULL","NULL","NULL","NULL",NA
"data","environment",NA,"extent","numeric vector","no",NA,"no",NA,"(xmin,xmax,ymin,ymax);","vectorize a raster::extent() object",NA,NA,NA,NA,NA,NA,NA,NA
"data","environment",NA,"extentRule","character","no",NA,"no",NA,"Buffered all points by 500km and joined the resulting polygons;","User specified",0,"NULL","NULL","NULL","NULL","NULL","NULL",NA
"data","environment",NA,"resolution","numeric vector","no",NA,"no",NA,NA,"A single bibtex format citation or a vector of bibtex format citations.",0,"NULL","NULL","NULL","NULL","NULL","NULL",NA
"data","environment",NA,"sources","character vector","no",NA,"no",NA,"@misc{hijmans2004worldclim,title={The WorldClim interpolated global terrestrial climate surfaces. Version 1.3},author={Hijmans, RJ and Cameron, SE and Parra, JL and Jones, PG and Jarvis, A},year={2004}}","A single bibtex format citation or a vector of bibtex format citations.",1,"NULL","NULL","NULL","NULL","NULL","NULL",NA
"data",NA,NA,"dataNotes","character","kinda",NA,"no",NA,NA,"User specified",1,"NULL","NULL","NULL","NULL","NULL","NULL",NA
"dataPrep","errors","duplicateRemoval","rule","character","no","environmental duplicates; coordinate duplicates; not needed; NA;","kinda",NA,"environmental duplicates; coordinate duplicates; not needed; NA;","If duplicate records were removed, what criteria were used for removal?",0,"NULL","NULL","NULL","NULL","NULL","NULL",NA
"dataPrep","errors","duplicateRemoval","notes","character","no",NA,"no",NA,"Duplicate removal performed on species with more than 10 occurrences;","User specified",0,"NULL","NULL","NULL","NULL","NULL","NULL",NA
"dataPrep","errors","oddPoints","rule","character","no",NA,"no",NA,"latitude or longitude exactly 0; latitude or longitude an integer;","If points were excluded on the basis of some criteria, what were they?",0,"NULL","NULL","NULL","NULL","NULL","NULL",NA
"dataPrep","errors","oddPoints","notes","character","no",NA,"no",NA,"Points that corresponded to 100 km lea centroids were removed;","User specified",0,"NULL","NULL","NULL","NULL","NULL","NULL",NA
"dataPrep","geographic","geographicHarmonization","rule","character","no","GNRS;  not needed; NA;","kinda",NA,"GNRS;  not needed; NA;","If an algorithm was used to standardize geographic or political names, which algorithm was used?",0,"NULL","NULL","NULL","NULL","NULL","NULL",NA
"dataPrep","geographic","geographicHarmonization","notes","character","no",NA,"no",NA,"Countries that could not be matched to GADM were manually corrected;","User specified",0,"NULL","NULL","NULL","NULL","NULL","NULL",NA
"dataPrep","geographic","geographicalOutlierRemoval","rule","character","no",NA,"no",NA,"Countries with fewer than 5 records were excluded; not needed; NA;","If points were excluded on the basis of  being a geographic outlier, what criteria or algorithm was used?",0,"NULL","NULL","NULL","NULL","NULL","NULL",NA
"dataPrep","geographic","geographicalOutlierRemoval","notes","character","no",NA,"no",NA,"Geographical outliers were only removed for species with more than 10 occurrences;","User specified",0,"NULL","NULL","NULL","NULL","NULL","NULL",NA
"dataPrep","geographic","centroidRemoval","rule","character","no","exact match; 0.98 likelihood score; not needed;","kinda",NA,"exact match; 0.98 likelihood score; not needed;","If  suspected centroid values were removed, what criteria were used to perform the removal?",0,"NULL","NULL","NULL","NULL","NULL","NULL",NA
"dataPrep","geographic","centroidRemoval","notes","character","no",NA,"no",NA,"Centroids analysis included both WGS84 and LEA centroids;","User specified",0,"NULL","NULL","NULL","NULL","NULL","NULL",NA
"dataPrep","geographic","pointInPolygon","rule","character","no","country; state; county; not needed;","kinda",NA,"country; state; county; not needed;","If point-in-polygon checks were used, what geopolitical levels were the checks perfromed for?",0,"NULL","NULL","NULL","NULL","NULL","NULL",NA
"dataPrep","geographic","pointInPolygon","notes","character","no",NA,"no",NA,"Point in polygon testing was done at the lowest declared political division;",NA,0,"NULL","NULL","NULL","NULL","NULL","NULL",NA
"dataPrep","geographic","altitudeCheck","rule","character","no",NA,"no",NA,"Altitude within 250 m of reported value; not needed;","If records were removed for having elevations reported that differ significantly from some source, what method was used?",0,"NULL","NULL","NULL","NULL","NULL","NULL",NA
"dataPrep","biological","taxonomicHarmonization","rule","character","no","TNRS; not needed;","kinda",NA,"TNRS; not needed;","If taxonomic harmonization was perfomed, which algorithm was used?",0,"NULL","NULL","NULL","NULL","NULL","NULL",NA
"dataPrep","biological","taxonomicHarmonization","notes","character","no",NA,"no",NA,"Taxa with no opinion in the TNRS were checked against ITIS.gov;","User specified",0,"NULL","NULL","NULL","NULL","NULL","NULL",NA
"dataPrep","biological","cultivatedRemoval","rule","character","no","CSR; not needed;","kinda",NA,"CSR; not needed;","If cultivated records were removed, what algorithm or criteria were used?",0,"NULL","NULL","NULL","NULL","NULL","NULL",NA
"dataPrep","biological","cultivatedRemoval","notes","character","no",NA,"no",NA,"Cultivated invasives were not removed;","User specified",0,"NULL","NULL","NULL","NULL","NULL","NULL",NA
"dataPrep","biological","nonNativeRemoval","rule","character","no","NSR; not needed;","kinda",NA,"NSR; not needed;","If introduced species were removed, what method/ source was used to assess native status?",0,"NULL","NULL","NULL","NULL","NULL","NULL",NA
"dataPrep","biological","nonNativeRemoval","notes","character","no",NA,"no",NA,NA,"User specified",0,"NULL","NULL","NULL","NULL","NULL","NULL",NA
"dataPrep","environmental","environmentalOutlierRemoval","rule","character","no",NA,"no",NA,"algorithm name; not needed;","If environmental outliers were removed, which algorithm was used to determine outlier status?",0,"NULL","NULL","NULL","NULL","NULL","NULL",NA
"dataPrep","environmental","environmentalOutlierRemoval","notes","character","no",NA,"no",NA,NA,"User specified",0,"NULL","NULL","NULL","NULL","NULL","NULL",NA
"dataPrep","environmental",NA,"notes","character","no",NA,"no",NA,NA,"User specified",0,"NULL","NULL","NULL","NULL","NULL","NULL",NA
"dataPrep",NA,NA,"dataPrepNotes","character vector","kinda",NA,"no",NA,NA,"User specified",1,"NULL","NULL","NULL","NULL","NULL","NULL",NA
"model",NA,NA,"occurrenceTreatedAs","character","no","point; cell; transect; polygon;","kinda",NA,"point; cell; transect; polygon;",NA,1,"NULL","NULL","NULL","NULL","NULL","NULL",NA
"model",NA,NA,"rangeType","character",NA,"potential;suitableArea;fundamental;realized;occupied",NA,NA,NA,NA,NA,NA,NA,NA,NA,NA,NA,NA
"model",NA,NA,"invasion","character",NA,"native;invasive;naturalized;colonized",NA,NA,NA,NA,NA,NA,NA,NA,NA,NA,NA,NA
"model",NA,NA,"transfer","character",NA,"space; time; both; no",NA,NA,NA,NA,NA,NA,NA,NA,NA,NA,NA,NA
"model",NA,NA,"populationType","character vector",NA,"breeding;wintering;migratory;resident",NA,NA,NA,NA,NA,NA,NA,NA,NA,NA,NA,NA
"model",NA,NA,"multispecies","character",NA,"yes; no",NA,NA,NA,"indicate whether taxon",NA,NA,NA,NA,NA,NA,NA,NA
"model",NA,NA,"covariateScaling","character","no","untransformed;  z-score; unit interval;","kinda",NA,"untransformed;  z-score; unit interval;",NA,1,"NULL","NULL","NULL","NULL","NULL","NULL",NA
"model",NA,NA,"occurrenceSubsampling","character","no","5-fold cross validation; none;","kinda",NA,"5-fold cross validation; none;",NA,1,"NULL","NULL","NULL","NULL","NULL","NULL",NA
"model",NA,NA,"offset","character","no",NA,"no",NA,"description;",NA,0,"NULL","NULL","NULL","NULL","NULL","NULL",NA
"model",NA,NA,"algorithm","character vector","kinda","generalized linear model; generalized additive model; boosted regression trees; maxent; bioclim;  Poisson point process; range bagging; all biomod2 models;","kinda",NA,"generalized linear model; generalized additive model; boosted regression trees; maxent; bioclim;  Poisson point process; range bagging; all biomod2 models;",NA,1,"NULL","NULL","NULL","NULL","NULL","NULL",NA
"model",NA,NA,"algorithmCitation","character vector","no",NA,"no",NA,"@article{phillips2006maximum,title={Maximum entropy modeling of species geographic distributions},author={Phillips, Steven J and Anderson, Robert P and Schapire, Robert E},journal={Ecological modelling},volume={190},number={3},pages={231--259},year={2006},publisher={Elsevier}}",NA,0,"NULL","NULL","NULL","NULL","NULL","NULL",NA
"model",NA,NA,"notes","character","no",NA,"no",NA,NA,"User specified",NA,NA,NA,NA,NA,NA,NA,NA
"model","partition",NA,"numberFolds","numeric","no",NA,NA,NA,"4","Number of folds used in kfold cross validation",0,"NULL","NULL","NULL","NULL","NULL","NULL",NA
"model","partition",NA,"partitionSet","character","no",NA,NA,NA,"spatial blocks","Partitioning method",0,"NULL","NULL","NULL","NULL","NULL","NULL",NA
"model","partition",NA,"partitionRule","character","no",NA,NA,NA,"spatial blocks defined by kmeans clustering","User specified",0,"NULL","NULL","NULL","NULL","NULL","NULL",NA
"model","maxent",NA,"featureSet","character vector","kinda","L; LQ; LQP; LQPT; LQPTH;  H; HT","kinda","maxent","L; LQ; LQP; LQPT; LQPTH;  H; HT","See maxent manual",0,"NULL","NULL","NULL","NULL","NULL","NULL",NA
"model","maxent",NA,"featureRule","character","no",NA,"no","maxent","L for <50 presences; LQ for >= 50 presences","See maxent manual",0,"NULL","NULL","NULL","NULL","NULL","NULL",NA
"model","maxent",NA,"regularizationMultiplierSet","numeric vector","kinda",NA,"no","maxent",NA,"See maxent manual",0,"NULL","NULL","NULL","NULL","NULL","NULL",NA
"model","maxent",NA,"regularizationRule","character","no",NA,"no","maxent","Chosen based on 5-fold cross validation on a grid of regularization multipliers from [0;10]","See maxent manual",0,"NULL","NULL","NULL","NULL","NULL","NULL",NA
"model","maxent",NA,"convergenceThresholdSet","numeric vector","kinda",NA,"no","maxent",NA,"See maxent manual",0,"NULL","NULL","NULL","NULL","NULL","NULL",NA
"model","maxent",NA,"convergenceThresholdRule","character","no",NA,"no","maxent",NA,"See maxent manual",0,"NULL","NULL","NULL","NULL","NULL","NULL",NA
"model","maxent",NA,"backgroundSizeSet","numeric vector","kinda",NA,"no","maxent",NA,"See maxent manual",0,"NULL","NULL","NULL","NULL","NULL","NULL",NA
"model","maxent",NA,"backgroundSizeRule","character","no",NA,"no","maxent","increased until gain plateau","See maxent manual",0,"NULL","NULL","NULL","NULL","NULL","NULL",NA
"model","maxent",NA,"samplingBiasRule","character","no","target group; offset; none;","kinda",NA,"target group; offset; none;","See maxent manual",0,"NULL","NULL","NULL","NULL","NULL","NULL",NA
"model","maxent",NA,"targetGroupSampleSize","numeric vector","kinda",NA,"no",NA,NA,"See: Phillips, S., M. Dudik, J. Elith, C. Graham, A. Lehmann, J. Leathwick, and S. Ferrier. 2009. Sample selection bias and presence-only distribution models: implications for background and pseudo-absence data. Ecological Applications 19:181–197.",0,"NULL","NULL","NULL","NULL","NULL","NULL",NA
"model","maxent",NA,"expertMapProbSet","numeric vector","kinda",NA,"no","maxentExpertMap",NA,"See: Merow, C., A. M. Wilson, and W. Jetz. 2017. Integrating occurrence data and expert maps for improved species range predictions. Global Ecology and Biogeography 26:243–258.",0,"NULL","NULL","NULL","NULL","NULL","NULL",NA
"model","maxent",NA,"expertMapProbRule","character","no",NA,"no","maxentExpertMap","Based on proportion of presences correctly classified","See: Merow, C., A. M. Wilson, and W. Jetz. 2017. Integrating occurrence data and expert maps for improved species range predictions. Global Ecology and Biogeography 26:243–258.",0,"NULL","NULL","NULL","NULL","NULL","NULL",NA
"model","maxent",NA,"expertMapRateSet","numeric vector","kinda",NA,"no","maxentExpertMap",NA,"See: Merow, C., A. M. Wilson, and W. Jetz. 2017. Integrating occurrence data and expert maps for improved species range predictions. Global Ecology and Biogeography 26:243–258.",0,"NULL","NULL","NULL","NULL","NULL","NULL",NA
"model","maxent",NA,"expertMapRateRule","character","no",NA,"no","maxentExpertMap",NA,"See: Merow, C., A. M. Wilson, and W. Jetz. 2017. Integrating occurrence data and expert maps for improved species range predictions. Global Ecology and Biogeography 26:243–258.",0,"NULL","NULL","NULL","NULL","NULL","NULL",NA
"model","maxent",NA,"expertMapSkewSet","numeric vector","kinda",NA,"no","maxentExpertMap",NA,"See: Merow, C., A. M. Wilson, and W. Jetz. 2017. Integrating occurrence data and expert maps for improved species range predictions. Global Ecology and Biogeography 26:243–258.",0,"NULL","NULL","NULL","NULL","NULL","NULL",NA
"model","maxent",NA,"expertMapSkewRule","character","no",NA,"no","maxentExpertMap",NA,"See: Merow, C., A. M. Wilson, and W. Jetz. 2017. Integrating occurrence data and expert maps for improved species range predictions. Global Ecology and Biogeography 26:243–258.",0,"NULL","NULL","NULL","NULL","NULL","NULL",NA
"model","maxent",NA,"expertMapShiftSet","numeric vector","kinda",NA,"no","maxentExpertMap",NA,"See: Merow, C., A. M. Wilson, and W. Jetz. 2017. Integrating occurrence data and expert maps for improved species range predictions. Global Ecology and Biogeography 26:243–258.",0,"NULL","NULL","NULL","NULL","NULL","NULL",NA
"model","maxent",NA,"expertMapShiftRule","character","no",NA,"no","maxentExpertMap",NA,"See: Merow, C., A. M. Wilson, and W. Jetz. 2017. Integrating occurrence data and expert maps for improved species range predictions. Global Ecology and Biogeography 26:243–258.",0,"NULL","NULL","NULL","NULL","NULL","NULL",NA
"model","maxent",NA,"notes","character vector","kinda",NA,"no",NA,NA,"User specified",0,"NULL","NULL","NULL","NULL","NULL","NULL",NA
"model","ensemble",NA,"notes",NA,NA,NA,NA,"ensemble",NA,"User specified",NA,NA,NA,NA,NA,NA,NA,NA
"model","glm",NA,"notes",NA,NA,NA,NA,"glm",NA,"User specified",NA,NA,NA,NA,NA,NA,NA,NA
"model","mars",NA,"notes",NA,NA,NA,NA,"mars",NA,"User specified",NA,NA,NA,NA,NA,NA,NA,NA
"model","brt",NA,"notes",NA,NA,NA,NA,"brt",NA,"User specified",NA,NA,NA,NA,NA,NA,NA,NA
"model","bioclim",NA,"notes",NA,NA,NA,NA,"bioclim",NA,"User specified",NA,NA,NA,NA,NA,NA,NA,NA
"model","randomForest",NA,"notes",NA,NA,NA,NA,"randomForest",NA,"User specified",NA,NA,NA,NA,NA,NA,NA,NA
"model","rangeBagging",NA,"notes",NA,NA,NA,NA,"rangeBagging",NA,"User specified",NA,NA,NA,NA,NA,NA,NA,NA
"output","prediction",NA,"units","character","no","absolute probability;  relative occurrence rate;","kinda",NA,"absolute probability;  relative occurrence rate;",NA,1,"NULL","NULL","NULL","NULL","NULL","NULL",NA
"output","prediction",NA,"minVal","numeric vector","kinda",NA,"no",NA,NA,NA,1,"NULL","NULL","NULL","NULL","NULL","NULL",NA
"output","prediction",NA,"maxVal","numeric vector","kinda",NA,"no",NA,NA,NA,1,"NULL","NULL","NULL","NULL","NULL","NULL",NA
"output","prediction",NA,"threshold","numeric vector","kinda",NA,"no",NA,NA,"only if binary/trinary",0,"NULL","NULL","NULL","NULL","NULL","NULL",NA
"output","prediction",NA,"notes","character vector","kinda",NA,"no",NA,NA,"User specified",1,"NULL","NULL","NULL","NULL","NULL","NULL",NA
"output","transfer","environment1","yearMin","integer","no",NA,"no","transferEnv1",NA,"additional environments can be addded as environment2, environments3, etc.",0,"NULL","NULL","NULL","NULL","NULL","NULL",NA
"output","transfer","environment1","yearMax","integer","no",NA,"no","transferEnv1",NA,NA,0,"NULL","NULL","NULL","NULL","NULL","NULL",NA
"output","transfer","environment1","sources","character vector","no",NA,"no","transferEnv1",NA,"A single bibtex format citation or a vector of bibtex format citations.",0,"NULL","NULL","NULL","NULL","NULL","NULL",NA
"output","transfer","environment1","extentSet","numeric vector","no",NA,"no","transferEnv1","(xmin,xmax,ymin,ymax)",NA,0,"NULL","NULL","NULL","NULL","NULL","NULL","this is already a vector; what if it differs by specie?"
"output","transfer","environment1","extentRule","character","no",NA,"no","transferEnv1","Buffered all points by 500km and joined the resulting polygons;",NA,0,"NULL","NULL","NULL","NULL","NULL","NULL",NA
"output","transfer","environment1","resolution","numeric","no",NA,"no","transferEnv1",NA,"A single bibtex format citation or a vector of bibtex format citations.",0,"NULL","NULL","NULL","NULL","NULL","NULL",NA
"output","transfer","environment2","yearMin","integer","no",NA,"no","transferEnv2",NA,NA,0,"NULL","NULL","NULL","NULL","NULL","NULL",NA
"output","transfer","environment2","yearMax","integer","no",NA,"no","transferEnv2",NA,NA,0,"NULL","NULL","NULL","NULL","NULL","NULL",NA
"output","transfer","environment2","sources","character vector","no",NA,"no","transferEnv2",NA,"A single bibtex format citation or a vector of bibtex format citations.",1,"NULL","NULL","NULL","NULL","NULL","NULL",NA
"output","transfer","environment2","extentSet","numeric vector","no",NA,"no","transferEnv2","(xmin,xmax,ymin,ymax)",NA,1,"NULL","NULL","NULL","NULL","NULL","NULL",NA
"output","transfer","environment2","extentRule","character","no",NA,"no","transferEnv2","Buffered all points by 500km and joined the resulting polygons;",NA,0,"NULL","NULL","NULL","NULL","NULL","NULL",NA
"output","transfer","environment2","resolution","numeric","no",NA,"no","transferEnv2",NA,"The spatial resolution of the environmental raster.",1,"NULL","NULL","NULL","NULL","NULL","NULL",NA
"output","transfer",NA,"notes","character vector","kinda",NA,"no",NA,NA,NA,0,"NULL","NULL","NULL","NULL","NULL","NULL",NA
"output","transfer",NA,"extrapolation","character","no","clamping; extrapolate function","kinda",NA,"clamping; extrapolate function","In Example 2, 'extrapolate function' indicates that the fitted functional form was not modified beyond the range of the data.",0,"NULL","NULL","NULL","NULL","NULL","NULL",NA
"output",NA,NA,"ensembleRule","character vector","kinda",NA,"no",NA,"Models weighted by AUC scores on test data;",NA,0,"NULL","NULL","NULL","NULL","NULL","NULL",NA
"output","uncertainty",NA,"units","character","no",NA,"no",NA,NA,NA,0,"NULL","NULL","NULL","NULL","NULL","NULL",NA
"output","uncertainty",NA,"minVal","numeric vector","kinda",NA,"no",NA,NA,NA,0,"NULL","NULL","NULL","NULL","NULL","NULL",NA
"output","uncertainty",NA,"maxVal","numeric vector","kinda",NA,"no",NA,NA,NA,0,"NULL","NULL","NULL","NULL","NULL","NULL",NA
"output","uncertainty",NA,"notes","character vector","kinda",NA,"no",NA,NA,NA,0,"NULL","NULL","NULL","NULL","NULL","NULL",NA
"performance","trainingDataStats",NA,"AUC","numeric vector","kinda",NA,"no",NA,NA,"See R package ROCR",0,"NULL","NULL","NULL","NULL","NULL","NULL",NA
"performance","trainingDataStats",NA,"pearsonCor","numeric vector","kinda",NA,"no",NA,NA,"See R package ROCR",0,"NULL","NULL","NULL","NULL","NULL","NULL",NA
"performance","trainingDataStats",NA,"CohensKappa","numeric vector","kinda",NA,"no",NA,NA,"See R package ROCR",0,"NULL","NULL","NULL","NULL","NULL","NULL",NA
"performance","trainingDataStats",NA,"trueSkillStatistic","numeric vector","kinda",NA,"no",NA,NA,"See R package ROCR",0,"NULL","NULL","NULL","NULL","NULL","NULL",NA
"performance","trainingDataStats",NA,"truePositiveRate","numeric vector","kinda",NA,"no",NA,NA,"See R package ROCR",0,"NULL","NULL","NULL","NULL","NULL","NULL",NA
"performance","trainingDataStats",NA,"trueNegativeRate","numeric vector","kinda",NA,"no",NA,NA,"See R package ROCR",0,"NULL","NULL","NULL","NULL","NULL","NULL",NA
"performance","trainingDataStats",NA,"falsePositiveRate","numeric vector","kinda",NA,"no",NA,NA,"See R package ROCR",0,"NULL","NULL","NULL","NULL","NULL","NULL",NA
"performance","trainingDataStats",NA,"falseNegativeRate","numeric vector","kinda",NA,"no",NA,NA,"See R package ROCR",0,"NULL","NULL","NULL","NULL","NULL","NULL",NA
"performance","trainingDataStats",NA,"binaryThreshold","numeric vector","kinda",NA,"no",NA,NA,"See R package ROCR",0,"NULL","NULL","NULL","NULL","NULL","NULL",NA
"performance","trainingDataStats",NA,"Boyce","numeric vector","kinda",NA,"no",NA,NA,"See R package ecospat",0,"NULL","NULL","NULL","NULL","NULL","NULL",NA
"performance","trainingDataStats",NA,"pAUC","numeric vector","kinda",NA,"no",NA,NA,"See R package pAUC",0,"NULL","NULL","NULL","NULL","NULL","NULL",NA
"performance","trainingDataStats",NA,"pAUCLoThreshold","numeric vector","kinda",NA,"no",NA,NA,"See R package pAUC",0,"NULL","NULL","NULL","NULL","NULL","NULL",NA
"performance","trainingDataStats",NA,"pAUCHiThreshold","numeric vector","kinda",NA,"no",NA,NA,"See R package pAUC",0,"NULL","NULL","NULL","NULL","NULL","NULL",NA
"performance","trainingDataStats",NA,"AIC","numeric vector","kinda",NA,"no",NA,NA,NA,0,"NULL","NULL","NULL","NULL","NULL","NULL",NA
"performance","trainingDataStats",NA,"BIC","numeric vector","kinda",NA,"no",NA,NA,NA,0,"NULL","NULL","NULL","NULL","NULL","NULL",NA
"performance","trainingDataStats",NA,"DIC","numeric vector","kinda",NA,"no",NA,NA,NA,0,"NULL","NULL","NULL","NULL","NULL","NULL",NA
"performance","testingDataStats",NA,"AUC","numeric vector","kinda",NA,"no",NA,NA,"See R package ROCR",0,"NULL","NULL","NULL","NULL","NULL","NULL",NA
"performance","testingDataStats",NA,"pearsonCor","numeric vector","kinda",NA,"no",NA,NA,"See R package ROCR",0,"NULL","NULL","NULL","NULL","NULL","NULL",NA
"performance","testingDataStats",NA,"CohensKappa","numeric vector","kinda",NA,"no",NA,NA,"See R package ROCR",0,"NULL","NULL","NULL","NULL","NULL","NULL",NA
